./data/CommonVoice2_dataset/clips/common_voice_en_17860847.mp3,"in many areas, there is enough sun so that solar is cheaper than anything else."
./data/CommonVoice2_dataset/clips/common_voice_en_17860848.mp3,mia turned seven today.
./data/CommonVoice2_dataset/clips/common_voice_en_17860849.mp3,tell me about it.
./data/CommonVoice2_dataset/clips/common_voice_en_17860850.mp3,"for a long time, the city's downfall was attributed to its second sacking."
./data/CommonVoice2_dataset/clips/common_voice_en_17860851.mp3,we were only half a mile from the destination when the engine packed in.
./data/CommonVoice2_dataset/clips/common_voice_en_17860852.mp3,lily is just as nearsighted as him.
./data/CommonVoice2_dataset/clips/common_voice_en_17860853.mp3,i'd add a separate subsection which deals with this aspect.
./data/CommonVoice2_dataset/clips/common_voice_en_17860854.mp3,i think i see john and mina over there in the vegetable aisle.
./data/CommonVoice2_dataset/clips/common_voice_en_17860855.mp3,look closely at the one on the left.
./data/CommonVoice2_dataset/clips/common_voice_en_17860856.mp3,what you eat today walks and talks tomorrow.
./data/CommonVoice2_dataset/clips/common_voice_en_17860857.mp3,we are going to the football game tonight.
./data/CommonVoice2_dataset/clips/common_voice_en_17860858.mp3,each clown's wig was secured by a tiny bowler hat held by an elastic chin-strap.
./data/CommonVoice2_dataset/clips/common_voice_en_17860859.mp3,leave tomorrow till tomorrow.
./data/CommonVoice2_dataset/clips/common_voice_en_17860860.mp3,don't spank your kids!
./data/CommonVoice2_dataset/clips/common_voice_en_17860861.mp3,eta eleven-thirty.
./data/CommonVoice2_dataset/clips/common_voice_en_17860862.mp3,use this internally to implement a service.
./data/CommonVoice2_dataset/clips/common_voice_en_17860863.mp3,"mayonnaise is made from eggs, oil, vinegar and mustard."
./data/CommonVoice2_dataset/clips/common_voice_en_17860864.mp3,never let the sun set on thy wrath.
./data/CommonVoice2_dataset/clips/common_voice_en_17860865.mp3,the internet should put the power in the hands of the many.
./data/CommonVoice2_dataset/clips/common_voice_en_17860866.mp3,this made them even richer.
./data/CommonVoice2_dataset/clips/common_voice_en_17860867.mp3,acceleration is the rate of change in velocity.
./data/CommonVoice2_dataset/clips/common_voice_en_17860869.mp3,a cloud of dust stung his tender eyes.
./data/CommonVoice2_dataset/clips/common_voice_en_498088.mp3,i don't know why you boys are so good to me.
./data/CommonVoice2_dataset/clips/common_voice_en_498089.mp3,thanks for the clarification!
./data/CommonVoice2_dataset/clips/common_voice_en_498090.mp3,we must get some of that serum as soon as possible.
./data/CommonVoice2_dataset/clips/common_voice_en_498091.mp3,"it doesn't come with too many built-in commands, but it's extremely easy to extend."
./data/CommonVoice2_dataset/clips/common_voice_en_498092.mp3,"after an avalanche buried the skiing resort, it was hard to determine its exact location."
./data/CommonVoice2_dataset/clips/common_voice_en_498093.mp3,i would appreciate if you could create a concise table.
./data/CommonVoice2_dataset/clips/common_voice_en_498094.mp3,"when talking to someone who has just started to learn the language, it's good to speak slowly and clearly."
./data/CommonVoice2_dataset/clips/common_voice_en_498095.mp3,if i send him to his dad's he won't get bathed for a week.
./data/CommonVoice2_dataset/clips/common_voice_en_498096.mp3,i see what you mean.
./data/CommonVoice2_dataset/clips/common_voice_en_498097.mp3,it would help the reader to understand your method better.
./data/CommonVoice2_dataset/clips/common_voice_en_498098.mp3,this makes me feel funny.
./data/CommonVoice2_dataset/clips/common_voice_en_498099.mp3,could have been on my way to old doc brown!
./data/CommonVoice2_dataset/clips/common_voice_en_498100.mp3,i'm afraid it is important.
./data/CommonVoice2_dataset/clips/common_voice_en_498101.mp3,in a little while.
./data/CommonVoice2_dataset/clips/common_voice_en_498102.mp3,walk in the grass in my bare feet?
./data/CommonVoice2_dataset/clips/common_voice_en_498103.mp3,come here a minute.
./data/CommonVoice2_dataset/clips/common_voice_en_498104.mp3,a missing parrot is called a polygon.
./data/CommonVoice2_dataset/clips/common_voice_en_498105.mp3,then get out of here.
./data/CommonVoice2_dataset/clips/common_voice_en_498106.mp3,shame on you and get off my front porch!
./data/CommonVoice2_dataset/clips/common_voice_en_498107.mp3,"however, the article is written poorly and incomprehensibly."
./data/CommonVoice2_dataset/clips/common_voice_en_498108.mp3,at different times of the week i have different motivations.
./data/CommonVoice2_dataset/clips/common_voice_en_498109.mp3,the reprieve for george.
./data/CommonVoice2_dataset/clips/common_voice_en_498110.mp3,why not right here?
./data/CommonVoice2_dataset/clips/common_voice_en_498111.mp3,i'll talk to you tonight.
./data/CommonVoice2_dataset/clips/common_voice_en_498112.mp3,this introduces ambiguities and doesn't work well for all clickable elements.
./data/CommonVoice2_dataset/clips/common_voice_en_498113.mp3,they found a cactus in a passenger's luggage at the airport's security check.
./data/CommonVoice2_dataset/clips/common_voice_en_498114.mp3,nice of you to come down.
./data/CommonVoice2_dataset/clips/common_voice_en_498115.mp3,not unless we're blind.
./data/CommonVoice2_dataset/clips/common_voice_en_498116.mp3,"many scientists work their entire careers on this, and you say you have solved this in a single afternoon?"
./data/CommonVoice2_dataset/clips/common_voice_en_498117.mp3,the article should be largely rewritten before any resubmission.
./data/CommonVoice2_dataset/clips/common_voice_en_548314.mp3,the adventures of tom sawyer.
./data/CommonVoice2_dataset/clips/common_voice_en_548315.mp3,the electrician looked puzzled.
./data/CommonVoice2_dataset/clips/common_voice_en_548316.mp3,i did not see her but i heard.
./data/CommonVoice2_dataset/clips/common_voice_en_548317.mp3,this one's dedicated to the ghetto where i come from.
./data/CommonVoice2_dataset/clips/common_voice_en_548318.mp3,i'd love me some iced tea right about now.
./data/CommonVoice2_dataset/clips/common_voice_en_548319.mp3,the crash of the ufo shows that extraterrestrials are also vulnerable.
./data/CommonVoice2_dataset/clips/common_voice_en_548320.mp3,the accommodation was affordable and cosy.
./data/CommonVoice2_dataset/clips/common_voice_en_548321.mp3,there's the door right there.
./data/CommonVoice2_dataset/clips/common_voice_en_548322.mp3,the hydrogen gas escaped.
./data/CommonVoice2_dataset/clips/common_voice_en_548324.mp3,the motorway is not the fastest connection between hamburg and munich.
./data/CommonVoice2_dataset/clips/common_voice_en_548325.mp3,what's the matter with him.
./data/CommonVoice2_dataset/clips/common_voice_en_548326.mp3,i recommend mouseless browsing for firefox and vimium for chrome.
./data/CommonVoice2_dataset/clips/common_voice_en_548327.mp3,the tribe was almost eradicated.
./data/CommonVoice2_dataset/clips/common_voice_en_548328.mp3,why can't she get along with me?
./data/CommonVoice2_dataset/clips/common_voice_en_548329.mp3,i know everything about you.
./data/CommonVoice2_dataset/clips/common_voice_en_548330.mp3,she was waiting for her response.
./data/CommonVoice2_dataset/clips/common_voice_en_548331.mp3,don't make a government project out of this!
./data/CommonVoice2_dataset/clips/common_voice_en_548332.mp3,it was a very warm october.
./data/CommonVoice2_dataset/clips/common_voice_en_548333.mp3,snakes are so scary!
./data/CommonVoice2_dataset/clips/common_voice_en_548334.mp3,they were suffering from hunger.
./data/CommonVoice2_dataset/clips/common_voice_en_548335.mp3,how would the method behave with kernels of different size?
./data/CommonVoice2_dataset/clips/common_voice_en_548336.mp3,was the doctor here?
./data/CommonVoice2_dataset/clips/common_voice_en_548337.mp3,it was a litmus test.
./data/CommonVoice2_dataset/clips/common_voice_en_548338.mp3,i had that five thousand bucks sewed up!
./data/CommonVoice2_dataset/clips/common_voice_en_548339.mp3,promise you'll never lie the way snoopy did.
./data/CommonVoice2_dataset/clips/common_voice_en_548340.mp3,"when doing reinforcement learning, we have to find a suitable trade-off between exploration and exploitation."
./data/CommonVoice2_dataset/clips/common_voice_en_548341.mp3,carol hid inside the shipping container.
./data/CommonVoice2_dataset/clips/common_voice_en_548342.mp3,"many scientists work their entire careers on this, and you say you have solved this in a single afternoon?"
./data/CommonVoice2_dataset/clips/common_voice_en_548343.mp3,keep your shirt on.
./data/CommonVoice2_dataset/clips/common_voice_en_548344.mp3,is there school today?
./data/CommonVoice2_dataset/clips/common_voice_en_548345.mp3,"after that foul, the whole stadium was yelling angry things."
./data/CommonVoice2_dataset/clips/common_voice_en_548346.mp3,i also recommend binding the shortcuts that let you quickly open a bookmark.
./data/CommonVoice2_dataset/clips/common_voice_en_17283561.mp3,"mrs. travis, when i leave my kids in kindergarten, i expect you to supervise them."
./data/CommonVoice2_dataset/clips/common_voice_en_17283562.mp3,"come on, i can handle it."
./data/CommonVoice2_dataset/clips/common_voice_en_17283563.mp3,"potatoes are less space-saving, durable and cheap than pasta."
./data/CommonVoice2_dataset/clips/common_voice_en_17283564.mp3,"don't knock on death's door, ring the doorbell and run."
./data/CommonVoice2_dataset/clips/common_voice_en_17283565.mp3,you could type it up manually.
./data/CommonVoice2_dataset/clips/common_voice_en_17283566.mp3,"roll the dice, please."
./data/CommonVoice2_dataset/clips/common_voice_en_17283567.mp3,now where could my pipe be?
./data/CommonVoice2_dataset/clips/common_voice_en_17283568.mp3,"the blackbird watched all this from the tree twisting its head left and right, blinking and testing its wings, before finally taking to the air."
./data/CommonVoice2_dataset/clips/common_voice_en_17283569.mp3,"some people like sea gulls, others don't."
./data/CommonVoice2_dataset/clips/common_voice_en_17283570.mp3,what made you stop playing?
./data/CommonVoice2_dataset/clips/common_voice_en_17283571.mp3,"speedbird niner, turn left heading two seven zero, climb and maintain flight level three five."
./data/CommonVoice2_dataset/clips/common_voice_en_17283572.mp3,"sooner or later three brothers, three castles."
./data/CommonVoice2_dataset/clips/common_voice_en_17283573.mp3,i wasn't certain it'd work at all yesterday.
./data/CommonVoice2_dataset/clips/common_voice_en_17283574.mp3,couldn't this have waited until morning?
./data/CommonVoice2_dataset/clips/common_voice_en_17283575.mp3,"first of all, i am introducing the facilitators of this science camp."
./data/CommonVoice2_dataset/clips/common_voice_en_17283576.mp3,i have been directed to assist you with your enquiries.
./data/CommonVoice2_dataset/clips/common_voice_en_17283577.mp3,"nora finds herself ugly, because she has pimples."
./data/CommonVoice2_dataset/clips/common_voice_en_17283578.mp3,"jerk the cord, and out tumbles the gold."
./data/CommonVoice2_dataset/clips/common_voice_en_17283579.mp3,where is my dress?
./data/CommonVoice2_dataset/clips/common_voice_en_17283580.mp3,"it's late in the evening, a perfect time for coffee."
./data/CommonVoice2_dataset/clips/common_voice_en_17283581.mp3,what joy there is in living?
./data/CommonVoice2_dataset/clips/common_voice_en_17283582.mp3,when was the last time you spoke with him prior to his departure?
./data/CommonVoice2_dataset/clips/common_voice_en_17283583.mp3,"on sunday mornings, he puts on his slippers and reads the newspaper on the cold patio."
./data/CommonVoice2_dataset/clips/common_voice_en_17283584.mp3,"what's the good of home, if you are never in it?"
./data/CommonVoice2_dataset/clips/common_voice_en_17283585.mp3,didn't you know that?
./data/CommonVoice2_dataset/clips/common_voice_en_17283586.mp3,"very well, if you'd like to start your inspection of the lab area i'll go and fetch her."
./data/CommonVoice2_dataset/clips/common_voice_en_17283587.mp3,what's the matter with me?
./data/CommonVoice2_dataset/clips/common_voice_en_17283588.mp3,what sort of man is he?
./data/CommonVoice2_dataset/clips/common_voice_en_17283589.mp3,"i understand that you're going to want to bring the cops in on this, but i can't be here when you do."
./data/CommonVoice2_dataset/clips/common_voice_en_17283590.mp3,"there's a variety of possibilities, but the checkerboard pattern doesn't seem appropriate here."
./data/CommonVoice2_dataset/clips/common_voice_en_17283591.mp3,what does it all mean?
./data/CommonVoice2_dataset/clips/common_voice_en_17283592.mp3,"in addition, the feature axis is configurable."
./data/CommonVoice2_dataset/clips/common_voice_en_17283593.mp3,have you ever been to a theater?
./data/CommonVoice2_dataset/clips/common_voice_en_18341796.mp3,answerphone is a common british term for a telephone answering machine
./data/CommonVoice2_dataset/clips/common_voice_en_18341797.mp3,"efficiency is important, but so is quality."
./data/CommonVoice2_dataset/clips/common_voice_en_18341798.mp3,james sighed as he realized they were seated way back in row r.
./data/CommonVoice2_dataset/clips/common_voice_en_18341809.mp3,my uncle was a member of the territorial army
./data/CommonVoice2_dataset/clips/common_voice_en_18341810.mp3,we mainly use python and tensorflow on our startup.
./data/CommonVoice2_dataset/clips/common_voice_en_18341811.mp3,he was the soul of devotion to his employers.
./data/CommonVoice2_dataset/clips/common_voice_en_18341824.mp3,where will the ceremony take place?
./data/CommonVoice2_dataset/clips/common_voice_en_18341827.mp3,he could feel a new stir in the land.
./data/CommonVoice2_dataset/clips/common_voice_en_18341829.mp3,"and now, down there, eileen was waiting for him."
./data/CommonVoice2_dataset/clips/common_voice_en_18341832.mp3,boxing day is the day after christmas day.
./data/CommonVoice2_dataset/clips/common_voice_en_18341844.mp3,"yet he dreams he is immortal, i argue feebly."
./data/CommonVoice2_dataset/clips/common_voice_en_18341846.mp3,nevertheless we found ourselves once more in the high seat of abundance.
./data/CommonVoice2_dataset/clips/common_voice_en_18341848.mp3,the other felt a sudden wave of irritation rush through him.
./data/CommonVoice2_dataset/clips/common_voice_en_18341849.mp3,the issue was not in doubt.
./data/CommonVoice2_dataset/clips/common_voice_en_18341850.mp3,open the display settings.
./data/CommonVoice2_dataset/clips/common_voice_en_18341851.mp3,to change gears you need to use the gear-lever
./data/CommonVoice2_dataset/clips/common_voice_en_18341852.mp3,"come off the motorway, take the next slip-road, then left at the roundabout"
./data/CommonVoice2_dataset/clips/common_voice_en_18341853.mp3,a car hire centre is a good place to rent a car
./data/CommonVoice2_dataset/clips/common_voice_en_18341856.mp3,"whitefish, gregson, whitefish and trout."
./data/CommonVoice2_dataset/clips/common_voice_en_18341857.mp3,"to say the least, captain cook was a rather thorough going empiricist."
./data/CommonVoice2_dataset/clips/common_voice_en_18341858.mp3,the referendum did not end as expected.
./data/CommonVoice2_dataset/clips/common_voice_en_18341931.mp3,we found five new vulnerabilities in the span of eight days.
./data/CommonVoice2_dataset/clips/common_voice_en_18341932.mp3,"when flying, i have often wondered about the expression arm the doors and crosscheck"
./data/CommonVoice2_dataset/clips/common_voice_en_18341944.mp3,what restaurants are nearby?
./data/CommonVoice2_dataset/clips/common_voice_en_18341945.mp3,the gala was fun.
./data/CommonVoice2_dataset/clips/common_voice_en_18341946.mp3,"rachel blushed, embarrassed, as she had never before received a b grade."
./data/CommonVoice2_dataset/clips/common_voice_en_18341947.mp3,he understood the meaning of the look.
./data/CommonVoice2_dataset/clips/common_voice_en_18341948.mp3,my birthday is in august.
./data/CommonVoice2_dataset/clips/common_voice_en_18341950.mp3,can you give me a brief summary?
./data/CommonVoice2_dataset/clips/common_voice_en_18341951.mp3,you should have seen them when they heard me spitting chinook.
./data/CommonVoice2_dataset/clips/common_voice_en_18341953.mp3,there's a big english general right now whose name is roberts.
./data/CommonVoice2_dataset/clips/common_voice_en_18341976.mp3,we should meet again in about a fortnight
./data/CommonVoice2_dataset/clips/common_voice_en_18341977.mp3,"won't you draw up, gentlemen."
./data/CommonVoice2_dataset/clips/common_voice_en_606486.mp3,his name is barry baldwin.
./data/CommonVoice2_dataset/clips/common_voice_en_606487.mp3,handle that with kid gloves.
./data/CommonVoice2_dataset/clips/common_voice_en_606488.mp3,it doesn't have to rhyme!
./data/CommonVoice2_dataset/clips/common_voice_en_606489.mp3,help my son megan tonight.
./data/CommonVoice2_dataset/clips/common_voice_en_606490.mp3,jennifer is making the nine o'clock train.
./data/CommonVoice2_dataset/clips/common_voice_en_606491.mp3,she had pneumonia once.
./data/CommonVoice2_dataset/clips/common_voice_en_606492.mp3,tell them to hold the wire.
./data/CommonVoice2_dataset/clips/common_voice_en_606495.mp3,i'm the one that knows.
./data/CommonVoice2_dataset/clips/common_voice_en_606496.mp3,what are you doing in here?
./data/CommonVoice2_dataset/clips/common_voice_en_606497.mp3,i happen to know conway was married only three months ago.
./data/CommonVoice2_dataset/clips/common_voice_en_606498.mp3,your method is systematic and mostly reasonably motivated.
./data/CommonVoice2_dataset/clips/common_voice_en_606499.mp3,i don't know you from adam.
./data/CommonVoice2_dataset/clips/common_voice_en_606500.mp3,nobody's trying to put anything over on you.
./data/CommonVoice2_dataset/clips/common_voice_en_606501.mp3,"for some reason, we were blocked from entering."
./data/CommonVoice2_dataset/clips/common_voice_en_606502.mp3,these are days of sacrifice!
./data/CommonVoice2_dataset/clips/common_voice_en_606503.mp3,i'm the stranger around here.
./data/CommonVoice2_dataset/clips/common_voice_en_606505.mp3,perhaps she forgot all about it.
./data/CommonVoice2_dataset/clips/common_voice_en_606506.mp3,they had a lot to divulge.
./data/CommonVoice2_dataset/clips/common_voice_en_606507.mp3,the carpet was exquisite.
./data/CommonVoice2_dataset/clips/common_voice_en_606508.mp3,why don't you fellows get your own news?
./data/CommonVoice2_dataset/clips/common_voice_en_606509.mp3,sexuality is a mystery.
./data/CommonVoice2_dataset/clips/common_voice_en_606510.mp3,i always have been.
./data/CommonVoice2_dataset/clips/common_voice_en_606511.mp3,"as the astronaut walked into the translucent pod, it transformed into an opaque material."
./data/CommonVoice2_dataset/clips/common_voice_en_606512.mp3,don't be an idiot!
./data/CommonVoice2_dataset/clips/common_voice_en_606513.mp3,you got your sea legs yet?
./data/CommonVoice2_dataset/clips/common_voice_en_606514.mp3,says for us to go the limit.
./data/CommonVoice2_dataset/clips/common_voice_en_606515.mp3,may i see it?
./data/CommonVoice2_dataset/clips/common_voice_en_606516.mp3,i know what you're feeling.
./data/CommonVoice2_dataset/clips/common_voice_en_606517.mp3,ellie won first prize in the spelling competition.
./data/CommonVoice2_dataset/clips/common_voice_en_606518.mp3,there goes another scrub lady.
./data/CommonVoice2_dataset/clips/common_voice_en_606519.mp3,we'll have some lunch and you can tell me everything.
./data/CommonVoice2_dataset/clips/common_voice_en_606520.mp3,the octopus worried the squid.
./data/CommonVoice2_dataset/clips/common_voice_en_606521.mp3,i felt a chill down my spine.
./data/CommonVoice2_dataset/clips/common_voice_en_606522.mp3,going up to see erin.
./data/CommonVoice2_dataset/clips/common_voice_en_33375.mp3,he had assumed he would soon return to his sheep.
./data/CommonVoice2_dataset/clips/common_voice_en_33376.mp3,and it knew nothing about love.
./data/CommonVoice2_dataset/clips/common_voice_en_33377.mp3,"""another dreamer,"" said the ticket seller to his assistant, watching the boy walk away."
./data/CommonVoice2_dataset/clips/common_voice_en_33378.mp3,"as the englishman left, fatima arrived and filled her vessel with water."
./data/CommonVoice2_dataset/clips/common_voice_en_33379.mp3,he took the fourth part and handed it to the monk.
./data/CommonVoice2_dataset/clips/common_voice_en_33380.mp3,and he gave the boy his blessing.
./data/CommonVoice2_dataset/clips/common_voice_en_33381.mp3,"now, i too will be one of the women who wait."
./data/CommonVoice2_dataset/clips/common_voice_en_33382.mp3,it sounded like a gypsy prayer.
./data/CommonVoice2_dataset/clips/common_voice_en_33383.mp3,only the lights in the great tent remained.
./data/CommonVoice2_dataset/clips/common_voice_en_33384.mp3,it had a diameter of about thirty yards.
./data/CommonVoice2_dataset/clips/common_voice_en_33385.mp3,there was a murmur from the crowd.
./data/CommonVoice2_dataset/clips/common_voice_en_33386.mp3,"and, above all, don't forget to follow your destiny through to its conclusion."
./data/CommonVoice2_dataset/clips/common_voice_en_33387.mp3,"as the sun rose, the men began to beat the boy."
./data/CommonVoice2_dataset/clips/common_voice_en_33388.mp3,it's like the camel driver said: 'eat when it's time to eat.
./data/CommonVoice2_dataset/clips/common_voice_en_33389.mp3,the stranger was speaking of things that very few people knew about.
./data/CommonVoice2_dataset/clips/common_voice_en_33390.mp3,"""we could get to the pyramids by tomorrow,"" said the other, taking the money."
./data/CommonVoice2_dataset/clips/common_voice_en_33391.mp3,"during the third year, the omens will continue to speak of your treasure and your destiny."
./data/CommonVoice2_dataset/clips/common_voice_en_33392.mp3,"""everyone on earth has a treasure that awaits him,"" his heart said."
./data/CommonVoice2_dataset/clips/common_voice_en_33393.mp3,"an old man, with a breastplate of gold, wouldn't have lied just to acquire six sheep."
./data/CommonVoice2_dataset/clips/common_voice_en_33394.mp3,and don't forget the language of omens.
./data/CommonVoice2_dataset/clips/common_voice_en_33395.mp3,almost everyone here speaks spanish.
./data/CommonVoice2_dataset/clips/common_voice_en_33396.mp3,to realize one's destiny is a person's only real obligation.
./data/CommonVoice2_dataset/clips/common_voice_en_33397.mp3,"""where your treasure is, there also will be your heart,"" the alchemist had told him."
./data/CommonVoice2_dataset/clips/common_voice_en_33398.mp3,he walked slowly through the market.
./data/CommonVoice2_dataset/clips/common_voice_en_33399.mp3,he didn't want to cry with the other people there.
./data/CommonVoice2_dataset/clips/common_voice_en_33400.mp3,"but he kept quiet, because he had heard what the alchemist said to the monk."
./data/CommonVoice2_dataset/clips/common_voice_en_33401.mp3,"then, you taught me something of the universal language and the soul of the world."
./data/CommonVoice2_dataset/clips/common_voice_en_33402.mp3,the guy thought he was a lunatic at large and made an unsuccessful attempt to stop him.
./data/CommonVoice2_dataset/clips/common_voice_en_33403.mp3,"in his heart, he wanted to remain awake, but he also wanted to sleep."
./data/CommonVoice2_dataset/clips/common_voice_en_33404.mp3,the boy trusted his new friend.
./data/CommonVoice2_dataset/clips/common_voice_en_33405.mp3,i looked at the cylinder again and was completely terrified.
./data/CommonVoice2_dataset/clips/common_voice_en_33406.mp3,"it required no explanation, just as the universe needs none as it travels through endless time."
./data/CommonVoice2_dataset/clips/common_voice_en_33407.mp3,i'm going to wait here for you every day.
./data/CommonVoice2_dataset/clips/common_voice_en_33408.mp3,"last time, i made the mistake of replicating a drawing by rodin."
./data/CommonVoice2_dataset/clips/common_voice_en_33409.mp3,i want my husband to wander as free as the wind that shapes the dunes.
./data/CommonVoice2_dataset/clips/common_voice_en_33410.mp3,he disappeared into the tent.
./data/CommonVoice2_dataset/clips/common_voice_en_17147782.mp3,june decided to retire.
./data/CommonVoice2_dataset/clips/common_voice_en_17147783.mp3,we must stay hidden.
./data/CommonVoice2_dataset/clips/common_voice_en_17147784.mp3,good company on the road is the shortest cut.
./data/CommonVoice2_dataset/clips/common_voice_en_17147785.mp3,that is quite another matter.
./data/CommonVoice2_dataset/clips/common_voice_en_17147786.mp3,"considering the growth of human population, insects might be the food of the future."
./data/CommonVoice2_dataset/clips/common_voice_en_17147787.mp3,a point is the beginning of magnitude.
./data/CommonVoice2_dataset/clips/common_voice_en_17147788.mp3,i could not trust this survey as it is being outdated.
./data/CommonVoice2_dataset/clips/common_voice_en_17147789.mp3,gray paint stretched for miles around.
./data/CommonVoice2_dataset/clips/common_voice_en_17147790.mp3,what do you think?
./data/CommonVoice2_dataset/clips/common_voice_en_17147791.mp3,"when the carpet and the curtains caught fire, it was getting warm."
./data/CommonVoice2_dataset/clips/common_voice_en_17147792.mp3,katie screamed that they were going to lose.
./data/CommonVoice2_dataset/clips/common_voice_en_17147793.mp3,my grandmother and i went inside the great pyramid.
./data/CommonVoice2_dataset/clips/common_voice_en_17147794.mp3,what have i done?
./data/CommonVoice2_dataset/clips/common_voice_en_17147795.mp3,we all know that our favorite day of the week is friday.
./data/CommonVoice2_dataset/clips/common_voice_en_17147796.mp3,"when a fox hears a rabbit screaming it comes running, but not to help."
./data/CommonVoice2_dataset/clips/common_voice_en_17147797.mp3,"given only the public key, it is very hard to compute the private one."
