./data/CommonVoice2_dataset/clips/common_voice_en_18834915.mp3,scammon's two regiments arrived and served as a rear-guard to cover the union retreat.
./data/CommonVoice2_dataset/clips/common_voice_en_18834916.mp3,it was established to oppose the war in afghanistan and later iraq.
./data/CommonVoice2_dataset/clips/common_voice_en_18834927.mp3,"at release, the browser was deemed too unstable for production use."
./data/CommonVoice2_dataset/clips/common_voice_en_18834928.mp3,a skins game format has also been adapted to the game of curling.
./data/CommonVoice2_dataset/clips/common_voice_en_18834929.mp3,the conflict was long and relentless.
./data/CommonVoice2_dataset/clips/common_voice_en_18834930.mp3,the staff leasing industry itself has also taken steps to address abuses.
./data/CommonVoice2_dataset/clips/common_voice_en_18834931.mp3,recently two fragmented slabs were found known as the elogia tarquiniensis.
./data/CommonVoice2_dataset/clips/common_voice_en_18834942.mp3,early dissolutions are allowed in many jurisdictions.
./data/CommonVoice2_dataset/clips/common_voice_en_18834943.mp3,dover is also home to the dover demon.
./data/CommonVoice2_dataset/clips/common_voice_en_18834944.mp3,executive education is a fundamental part of the school activities.
./data/CommonVoice2_dataset/clips/common_voice_en_18834945.mp3,he was characterised in parliament by his three-piece suits and strong 'mackem' accent.
./data/CommonVoice2_dataset/clips/common_voice_en_18834946.mp3,"in that case the iteration should be bypassed; otherwise, division by zero may result."
./data/CommonVoice2_dataset/clips/common_voice_en_18834960.mp3,"during the russo turkish war rozhestvensky served on board the gunboat ""vesta""."
./data/CommonVoice2_dataset/clips/common_voice_en_18834962.mp3,"father of punga was tangaroa, king of the sea."
./data/CommonVoice2_dataset/clips/common_voice_en_18834963.mp3,"at that time it included two major canadian department stores, simpson's and eaton's."
./data/CommonVoice2_dataset/clips/common_voice_en_18834965.mp3,"her sculpture, ""puck and owl"", is featured on the boston women's heritage trail."
./data/CommonVoice2_dataset/clips/common_voice_en_18834966.mp3,"papelbon and his wife, ashley jefferies, live in hattiesburg, mississippi."
./data/CommonVoice2_dataset/clips/common_voice_en_18834977.mp3,also has the campus graduate of the university don bosco.
./data/CommonVoice2_dataset/clips/common_voice_en_18834979.mp3,"the largest towns in the achterhoek are: doetinchem, winterswijk, and zutphen."
./data/CommonVoice2_dataset/clips/common_voice_en_18834981.mp3,there are various other mathematical concepts that can be used to represent complete lattices.
./data/CommonVoice2_dataset/clips/common_voice_en_18834982.mp3,geodes and geode slices are sometimes dyed with artificial colors.
./data/CommonVoice2_dataset/clips/common_voice_en_18834983.mp3,robertson then trained for a further two years and became a technical officer.
./data/CommonVoice2_dataset/clips/common_voice_en_18835012.mp3,higher speeds and tighter turns require greater lean angles.
./data/CommonVoice2_dataset/clips/common_voice_en_18835013.mp3,teresa dies holding on to the bear that arturo gave her.
./data/CommonVoice2_dataset/clips/common_voice_en_18835014.mp3,some end-to-end protocols behave better under congested conditions.
./data/CommonVoice2_dataset/clips/common_voice_en_18835015.mp3,porteous concluded that mendel's observations were indeed implausible.
./data/CommonVoice2_dataset/clips/common_voice_en_18835016.mp3,the unicoi mountains rise prominently to the southeast.
./data/CommonVoice2_dataset/clips/common_voice_en_18835037.mp3,"in contrast, digitigrade animals walk on their distal and intermediate phalanges."
./data/CommonVoice2_dataset/clips/common_voice_en_18835039.mp3,two villages are administered by the town: alexandru ioan cuza and gostilele.
./data/CommonVoice2_dataset/clips/common_voice_en_18835040.mp3,"the mineral ""websterite"" now known as aluminite was named after him."
./data/CommonVoice2_dataset/clips/common_voice_en_18835041.mp3,he also wore the captain's armband in many of the matches.
./data/CommonVoice2_dataset/clips/common_voice_en_18835077.mp3,their results indicate that more electron-withdrawing substituents have less repulsive pi stacking interactions.
./data/CommonVoice2_dataset/clips/common_voice_en_18835078.mp3,designed by the architects thomas somerford and e. a.
./data/CommonVoice2_dataset/clips/common_voice_en_18835079.mp3,the first settlers around kidapawan were predominantly manobos.
./data/CommonVoice2_dataset/clips/common_voice_en_18835080.mp3,the two boer republics had collapsed without any bloodshed.
./data/CommonVoice2_dataset/clips/common_voice_en_18835081.mp3,"gary berkowitz and management then brought in scott walker, as program director."
./data/CommonVoice2_dataset/clips/common_voice_en_18835097.mp3,"unfortunately, doing so led to numerous crashes for a variety of reasons."
./data/CommonVoice2_dataset/clips/common_voice_en_18835098.mp3,over-the-air viewers actually benefited from this particular switch.
./data/CommonVoice2_dataset/clips/common_voice_en_18835099.mp3,"mengoni's work, in any case, was not hitchless."
./data/CommonVoice2_dataset/clips/common_voice_en_18835100.mp3,"in these areas, traffic fines are doubled."
./data/CommonVoice2_dataset/clips/common_voice_en_18835101.mp3,"there are salaried imams and muezzins, as well as jurists and scholars."
./data/CommonVoice2_dataset/clips/common_voice_en_18835127.mp3,lava domes are one of the principal structural features of many stratovolcanoes worldwide.
./data/CommonVoice2_dataset/clips/common_voice_en_18835128.mp3,"for many years, he has lived in an upper east side penthouse in manhattan."
./data/CommonVoice2_dataset/clips/common_voice_en_18835129.mp3,"however, a number of artificial systems have since been established."
./data/CommonVoice2_dataset/clips/common_voice_en_18835130.mp3,all songs written by mark e. nevin and morrissey.
./data/CommonVoice2_dataset/clips/common_voice_en_18835131.mp3,the tree grows between tall and is native to tropical dry forests of africa.
./data/CommonVoice2_dataset/clips/common_voice_en_18835157.mp3,"thil was born in saint-dizier, a commune in the haute-marne department in north-eastern france."
./data/CommonVoice2_dataset/clips/common_voice_en_18835158.mp3,in turn the tree is fertilized by the snake's urine and embryotic fluid.
./data/CommonVoice2_dataset/clips/common_voice_en_18835159.mp3,"this epithet often designates negative personal characteristics, such as laziness and ignorance."
./data/CommonVoice2_dataset/clips/common_voice_en_18835160.mp3,it is now held in storage at transadelaide's glengowrie depot storage for spare parts.
./data/CommonVoice2_dataset/clips/common_voice_en_18835161.mp3,his son shun'ichi suzuki currently serves in the diet.
./data/CommonVoice2_dataset/clips/common_voice_en_18835182.mp3,the village of stockbridge is slightly north of the center of the town.
./data/CommonVoice2_dataset/clips/common_voice_en_18835183.mp3,i wish i could call her amiable.
./data/CommonVoice2_dataset/clips/common_voice_en_18835184.mp3,her brothers are the late canadian actor bruce boa and jungian analyst fraser boa.
./data/CommonVoice2_dataset/clips/common_voice_en_18835185.mp3,"the name literally means ""the truth""."
./data/CommonVoice2_dataset/clips/common_voice_en_18835186.mp3,phillippe was present during the birth.
./data/CommonVoice2_dataset/clips/common_voice_en_18835212.mp3,currently alimentation couche-tard is one of the largest convenience store companies in the world.
./data/CommonVoice2_dataset/clips/common_voice_en_18835213.mp3,ossining is the location of sing sing maximum-security prison.
./data/CommonVoice2_dataset/clips/common_voice_en_18835214.mp3,"he moved to philadelphia, a center of publishing and research, without employment."
./data/CommonVoice2_dataset/clips/common_voice_en_18835215.mp3,"pugh was born in llwynypia, mid glamorgan, into a poor coal mining family."
./data/CommonVoice2_dataset/clips/common_voice_en_18835216.mp3,the work of the trust is carried out through staff and volunteers.
./data/CommonVoice2_dataset/clips/common_voice_en_18835242.mp3,"it includes no bibliography, and few notes."
./data/CommonVoice2_dataset/clips/common_voice_en_18835243.mp3,"now, in its sixth season, she serves as writer and supervising producer."
./data/CommonVoice2_dataset/clips/common_voice_en_18835244.mp3,he hopes the project will help improve living standards in developing countries.
./data/CommonVoice2_dataset/clips/common_voice_en_18835245.mp3,"his individual works included polemica, hagiographical and liturgical works, sermons and poetry."
./data/CommonVoice2_dataset/clips/common_voice_en_18835246.mp3,"deprez studied philosophy, language and literature and added postgraduate studies in sociology."
./data/CommonVoice2_dataset/clips/common_voice_en_18835267.mp3,he was a presbyterian elder.
./data/CommonVoice2_dataset/clips/common_voice_en_18835268.mp3,this species belongs to the close-knit hierofalcon complex.
./data/CommonVoice2_dataset/clips/common_voice_en_18835269.mp3,the two teams last placed overall are relegated.
./data/CommonVoice2_dataset/clips/common_voice_en_18835270.mp3,count gregor renounced his bad ways and became the town monk.
./data/CommonVoice2_dataset/clips/common_voice_en_18835271.mp3,"they reported to the ""supreme cacique"", who during jumacao's time was the cacique agueybana."
./data/CommonVoice2_dataset/clips/common_voice_en_18835297.mp3,"edward j. cummings, junior in command."
./data/CommonVoice2_dataset/clips/common_voice_en_18835298.mp3,a saddleback locomotive was used.
./data/CommonVoice2_dataset/clips/common_voice_en_18835299.mp3,the art of fighting with war fans is tessenjutsu.
./data/CommonVoice2_dataset/clips/common_voice_en_18835300.mp3,"bucking conventional industry wisdom, she booked a successful tour for herself and paula cole."
./data/CommonVoice2_dataset/clips/common_voice_en_18835307.mp3,"there are many temples, mosques, churches, guruduwaras."
./data/CommonVoice2_dataset/clips/common_voice_en_18835308.mp3,some volcanic formations are found throughout the range.
./data/CommonVoice2_dataset/clips/common_voice_en_18835309.mp3,"her poems have been translated into many different languages, including german and english."
./data/CommonVoice2_dataset/clips/common_voice_en_18835310.mp3,"at the time, he was the youngest ambassador in romania's diplomatic corps."
./data/CommonVoice2_dataset/clips/common_voice_en_18835311.mp3,the title was taken from a catchphrase used in the television show.
./data/CommonVoice2_dataset/clips/common_voice_en_18835312.mp3,there are also logic puzzles that are completely non-verbal in nature.
./data/CommonVoice2_dataset/clips/common_voice_en_18835313.mp3,its entrance difficulty is also very selective.
./data/CommonVoice2_dataset/clips/common_voice_en_18835314.mp3,auguste rodin and camille claudel are the most famous sculptors of their time.
./data/CommonVoice2_dataset/clips/common_voice_en_18835315.mp3,"the carol is traditionally sung ""a cappella""."
./data/CommonVoice2_dataset/clips/common_voice_en_18835316.mp3,the group was initially put together by music producers louis baldonieri and brian lukow.
./data/CommonVoice2_dataset/clips/common_voice_en_18835317.mp3,this game simulated automobile production and stock manipulation.
./data/CommonVoice2_dataset/clips/common_voice_en_18835318.mp3,it was there that he died.
./data/CommonVoice2_dataset/clips/common_voice_en_18835319.mp3,the name of the town came from that of the english admiral john byng.
./data/CommonVoice2_dataset/clips/common_voice_en_18835320.mp3,white is a former member of the royal canadian air force.
./data/CommonVoice2_dataset/clips/common_voice_en_18835321.mp3,rooke sent ships to explore the mouth of vigo bay.
./data/CommonVoice2_dataset/clips/common_voice_en_18835332.mp3,the reasons for women's exclusion are various.
./data/CommonVoice2_dataset/clips/common_voice_en_18835333.mp3,ashmont hill architectural conservation district is a pending boston landmark.
./data/CommonVoice2_dataset/clips/common_voice_en_18835334.mp3,"she has two children, and lives in ridgefield, connecticut."
./data/CommonVoice2_dataset/clips/common_voice_en_18835335.mp3,"these are both regularly played on the ""doctor demento"" radio show."
./data/CommonVoice2_dataset/clips/common_voice_en_18835336.mp3,his life was changed as a result of the visit of the theatre.
./data/CommonVoice2_dataset/clips/common_voice_en_48645.mp3,my review of the sun: one star.
./data/CommonVoice2_dataset/clips/common_voice_en_48646.mp3,he felt uneasy at the man's presence.
./data/CommonVoice2_dataset/clips/common_voice_en_48647.mp3,"from atop its walls, one can catch a glimpse of africa."
./data/CommonVoice2_dataset/clips/common_voice_en_48649.mp3,"nearby was the englishman, reading a book."
./data/CommonVoice2_dataset/clips/common_voice_en_48650.mp3,the boy was surprised.
./data/CommonVoice2_dataset/clips/common_voice_en_48653.mp3,he had come to the town only to find a woman who could interpret his dream.
./data/CommonVoice2_dataset/clips/common_voice_en_48654.mp3,"how strange africa is, thought the boy."
./data/CommonVoice2_dataset/clips/common_voice_en_48655.mp3,"at most, they thought that another meteorite had descended."
./data/CommonVoice2_dataset/clips/common_voice_en_48656.mp3,"we are obliged, at least once in our lives, to visit the holy city of mecca."
./data/CommonVoice2_dataset/clips/common_voice_en_48657.mp3,there was no way for everybody to know about alchemy.
./data/CommonVoice2_dataset/clips/common_voice_en_48659.mp3,"it's too bad that he's quickly going to forget my name, he thought."
./data/CommonVoice2_dataset/clips/common_voice_en_48661.mp3,"if a person is living out his destiny, he knows everything he needs to know."
./data/CommonVoice2_dataset/clips/common_voice_en_48662.mp3,he took his money from his pouch and showed it to the young man.
./data/CommonVoice2_dataset/clips/common_voice_en_48664.mp3,but he certainly didn't desire that an army invade the oasis.
./data/CommonVoice2_dataset/clips/common_voice_en_48665.mp3,"""i'm an adventurer, looking for treasure,"" he said to himself."
./data/CommonVoice2_dataset/clips/common_voice_en_48666.mp3,dense clouds of smoke or dust can be seen through a powerful telescope.
./data/CommonVoice2_dataset/clips/common_voice_en_48667.mp3,now his intuition was that he had been right in coming.
./data/CommonVoice2_dataset/clips/common_voice_en_48668.mp3,"""all things are one,"" the old man had said."
./data/CommonVoice2_dataset/clips/common_voice_en_48669.mp3,"""what is love?"" the desert asked."
./data/CommonVoice2_dataset/clips/common_voice_en_48673.mp3,"he was tense and upset, because he knew that the old man was right."
./data/CommonVoice2_dataset/clips/common_voice_en_48676.mp3,"""i have had the same dream twice,"" he said."
./data/CommonVoice2_dataset/clips/common_voice_en_48677.mp3,always ask an objective question.
./data/CommonVoice2_dataset/clips/common_voice_en_48678.mp3,"the next day, the boy returned to the well, hoping to see the girl."
./data/CommonVoice2_dataset/clips/common_voice_en_48679.mp3,fatima appeared at the entrance to the tent.
./data/CommonVoice2_dataset/clips/common_voice_en_48680.mp3,"the camel drivers exchanged information about windstorms, and told stories about the desert."
./data/CommonVoice2_dataset/clips/common_voice_en_48681.mp3,"if i don't find it, i can always go home."
./data/CommonVoice2_dataset/clips/common_voice_en_48682.mp3,"you'll marry fatima, and you'll both be happy for a year."
./data/CommonVoice2_dataset/clips/common_voice_en_48683.mp3,they were strange books.
./data/CommonVoice2_dataset/clips/common_voice_en_48684.mp3,"the horizon was tinged with red, and suddenly the sun appeared."
./data/CommonVoice2_dataset/clips/common_voice_en_48685.mp3,i'd like you to take me there if you can.
./data/CommonVoice2_dataset/clips/common_voice_en_48686.mp3,"there was a time when, for me, a camel's whinnying was nothing more than whinnying."
./data/CommonVoice2_dataset/clips/common_voice_en_48687.mp3,"on the first day he returned with a rabbit, and on the second with two birds."
./data/CommonVoice2_dataset/clips/common_voice_en_48688.mp3,and they had understood each other perfectly well.
./data/CommonVoice2_dataset/clips/common_voice_en_48690.mp3,"throughout the night, the boy dug at the place he had chosen, but found nothing."
./data/CommonVoice2_dataset/clips/common_voice_en_48691.mp3,the boy observed in silence the progress of the animals and people across the desert.
./data/CommonVoice2_dataset/clips/common_voice_en_48693.mp3,"""i'm surprised,"" the boy said."
./data/CommonVoice2_dataset/clips/common_voice_en_48694.mp3,because life wants you to achieve your destiny.
./data/CommonVoice2_dataset/clips/common_voice_en_48695.mp3,it was as if the world had fallen silent because the boy's soul had.
./data/CommonVoice2_dataset/clips/common_voice_en_48696.mp3,he recited an our father silently.
./data/CommonVoice2_dataset/clips/common_voice_en_48697.mp3,the serpent relaxed immediately.
./data/CommonVoice2_dataset/clips/common_voice_en_48698.mp3,"but, most important, he was able every day to live out his dream."
./data/CommonVoice2_dataset/clips/common_voice_en_48699.mp3,love required them to stay with the people they loved.
./data/CommonVoice2_dataset/clips/common_voice_en_48700.mp3,all that time the martians must have been getting ready.
./data/CommonVoice2_dataset/clips/common_voice_en_48701.mp3,"now, i can see that it hasn't been too bad."
./data/CommonVoice2_dataset/clips/common_voice_en_48702.mp3,"for at that time, it had not occurred to him that it might be hollow."
./data/CommonVoice2_dataset/clips/common_voice_en_48703.mp3,"""men dream more about coming home than about leaving,"" the boy said."
./data/CommonVoice2_dataset/clips/common_voice_en_48704.mp3,he was immensely excited at the news.
./data/CommonVoice2_dataset/clips/common_voice_en_48705.mp3,but the merchant understood what the boy had said.
./data/CommonVoice2_dataset/clips/common_voice_en_48707.mp3,it seemed he had made the long journey for nothing.
./data/CommonVoice2_dataset/clips/common_voice_en_48708.mp3,they went on smoking the pipe for a while as the sun began to set.
./data/CommonVoice2_dataset/clips/common_voice_en_48710.mp3,but fatima's hands held to the handles of her jug.
./data/CommonVoice2_dataset/clips/common_voice_en_48711.mp3,"that night, he told all of this to the alchemist."
./data/CommonVoice2_dataset/clips/common_voice_en_48712.mp3,"when the lead had become liquid, the alchemist took from his pouch the strange yellow egg."
./data/CommonVoice2_dataset/clips/common_voice_en_48713.mp3,she knows that men have to go away in order to return.
./data/CommonVoice2_dataset/clips/common_voice_en_48715.mp3,"""he wanted your money,"" he said."
./data/CommonVoice2_dataset/clips/common_voice_en_48716.mp3,"and that he, a boy, could perform miracles."
./data/CommonVoice2_dataset/clips/common_voice_en_48717.mp3,he's doing it because it's what he wants to do.
./data/CommonVoice2_dataset/clips/common_voice_en_48718.mp3,"without such love, one's dreams would have no meaning."
./data/CommonVoice2_dataset/clips/common_voice_en_48719.mp3,he understands the forces of nature.
./data/CommonVoice2_dataset/clips/common_voice_en_48720.mp3,"meanwhile, the boy thought about his treasure."
./data/CommonVoice2_dataset/clips/common_voice_en_48721.mp3,"""tell me more about your dream,"" said the woman."
./data/CommonVoice2_dataset/clips/common_voice_en_48722.mp3,"it knew of the boy's talk with the desert, because the winds know everything."
./data/CommonVoice2_dataset/clips/common_voice_en_48723.mp3,they never found the secret.
./data/CommonVoice2_dataset/clips/common_voice_en_48724.mp3,the boy knew a lot of people in the city.
./data/CommonVoice2_dataset/clips/common_voice_en_48725.mp3,"if someone isn't what others want them to be, the others become angry."
./data/CommonVoice2_dataset/clips/common_voice_en_48726.mp3,"and to do that, you need money."
./data/CommonVoice2_dataset/clips/common_voice_en_48727.mp3,others stumbled upon the stone by accident.
./data/CommonVoice2_dataset/clips/common_voice_en_48728.mp3,the boy was surprised at his thoughts.
./data/CommonVoice2_dataset/clips/common_voice_en_48729.mp3,"there were raised voices,and some sort of struggle appeared to be going on. ."
./data/CommonVoice2_dataset/clips/common_voice_en_48730.mp3,"he thought about asking him to give it back, but decided that would be unfriendly."
./data/CommonVoice2_dataset/clips/common_voice_en_48731.mp3,the man wept with happiness.
./data/CommonVoice2_dataset/clips/common_voice_en_48732.mp3,"then, taking his sheep, he walked away."
./data/CommonVoice2_dataset/clips/common_voice_en_48733.mp3,"""it is i,"" the boy answered."
./data/CommonVoice2_dataset/clips/common_voice_en_48734.mp3,even though the sheep didn't teach me to speak arabic.
./data/CommonVoice2_dataset/clips/common_voice_en_48735.mp3,he was proud of himself.
./data/CommonVoice2_dataset/clips/common_voice_en_48736.mp3,he knew nothing about the customs of the strange land he was in.
./data/CommonVoice2_dataset/clips/common_voice_en_48737.mp3,"""that's the way it always is,"" said the old man."
./data/CommonVoice2_dataset/clips/common_voice_en_48738.mp3,"arabs often appeared in the city, shopping and chanting their strange prayers several times a day."
./data/CommonVoice2_dataset/clips/common_voice_en_48739.mp3,not everyone can see his dreams come true in the same way.
./data/CommonVoice2_dataset/clips/common_voice_en_48740.mp3,"i thought that someday i'd be rich, and could go to mecca."
./data/CommonVoice2_dataset/clips/common_voice_en_48742.mp3,"when i had my sheep, i was happy, and i made those around me happy."
./data/CommonVoice2_dataset/clips/common_voice_en_48743.mp3,you knew the whole story.
./data/CommonVoice2_dataset/clips/common_voice_en_48744.mp3,because he knew what he would find.
./data/CommonVoice2_dataset/clips/common_voice_en_48745.mp3,it spread through the planet's atmosphere and obscured its more familiar features.
./data/CommonVoice2_dataset/clips/common_voice_en_48746.mp3,but the boy was certain that he had been looking at them.
./data/CommonVoice2_dataset/clips/common_voice_en_48747.mp3,"""ask the owner of that stall how much the sword costs,"" he said to his friend."
./data/CommonVoice2_dataset/clips/common_voice_en_48748.mp3,don't try to enter into the life of the oasis.
./data/CommonVoice2_dataset/clips/common_voice_en_48749.mp3,but arms cannot be drawn unless they also go into battle.
./data/CommonVoice2_dataset/clips/common_voice_en_48750.mp3,he noticed the unequal cooling of its surface.
./data/CommonVoice2_dataset/clips/common_voice_en_48751.mp3,the stranger seemed satisfied with the answer.
./data/CommonVoice2_dataset/clips/common_voice_en_48753.mp3,"""somewhere you are holding the person i love,"" the boy said."
./data/CommonVoice2_dataset/clips/common_voice_en_48754.mp3,he took out his money and counted it.
./data/CommonVoice2_dataset/clips/common_voice_en_48755.mp3,"a young arab, also loaded down with baggage, entered, and greeted the englishman."
./data/CommonVoice2_dataset/clips/common_voice_en_48757.mp3,"the day was hot, and the wine was refreshing."
./data/CommonVoice2_dataset/clips/common_voice_en_48759.mp3,"the levanter was still getting stronger, and he felt its force on his face."
./data/CommonVoice2_dataset/clips/common_voice_en_48760.mp3,melchizedek watched a small ship that was plowing its way out of the port.
./data/CommonVoice2_dataset/clips/common_voice_en_48761.mp3,"the old man leafed through the book, and fell to reading a page he came to."
./data/CommonVoice2_dataset/clips/common_voice_en_48762.mp3,his name was joseph.
./data/CommonVoice2_dataset/clips/common_voice_en_48763.mp3,"""that's never happened to me,"" the boy said."
./data/CommonVoice2_dataset/clips/common_voice_en_48766.mp3,the sword didn't fall.
./data/CommonVoice2_dataset/clips/common_voice_en_48767.mp3,the old man said nothing.
./data/CommonVoice2_dataset/clips/common_voice_en_48768.mp3,"when he was a child, that man wanted to travel, too."
./data/CommonVoice2_dataset/clips/common_voice_en_48770.mp3,hires two personal trainers and make one of them train the other one.
./data/CommonVoice2_dataset/clips/common_voice_en_48771.mp3,"""i'm going into the desert,"" the man answered, turning back to his reading."
./data/CommonVoice2_dataset/clips/common_voice_en_48772.mp3,but we could sell tea in crystal glasses.
./data/CommonVoice2_dataset/clips/common_voice_en_48773.mp3,most meteorites are more or less rounded.
./data/CommonVoice2_dataset/clips/common_voice_en_48775.mp3,"from then on, he would make his own decisions."
./data/CommonVoice2_dataset/clips/common_voice_en_48777.mp3,only in that way would he be able to read the omens.
./data/CommonVoice2_dataset/clips/common_voice_en_48778.mp3,he must know how to deal with the snakes of the desert.
./data/CommonVoice2_dataset/clips/common_voice_en_48779.mp3,i told him we could teach her to ignore people who waste her time.
./data/CommonVoice2_dataset/clips/common_voice_en_48780.mp3,the caravan moved toward the east.
./data/CommonVoice2_dataset/clips/common_voice_en_48781.mp3,"i was just in town earlier this year, so it is kind of crazy to think about what took place right after."
./data/CommonVoice2_dataset/clips/common_voice_en_48782.mp3,the people were also praying to heaven for protection.
./data/CommonVoice2_dataset/clips/common_voice_en_48783.mp3,"he ran his fingers slowly over the stones, sensing their temperature and feeling their surfaces."
./data/CommonVoice2_dataset/clips/common_voice_en_48784.mp3,"he thought that, with some patience, he'd be able to transform everything into gold."
./data/CommonVoice2_dataset/clips/common_voice_en_48786.mp3,i myself heard nothing of that.
