./data/CommonVoice2_dataset/clips/common_voice_en_143996.mp3,and what's the matter with a thousand dollars?
./data/CommonVoice2_dataset/clips/common_voice_en_143997.mp3,see you in the funny papers.
./data/CommonVoice2_dataset/clips/common_voice_en_143998.mp3,give me the district attorney's office.
./data/CommonVoice2_dataset/clips/common_voice_en_143999.mp3,i gotta figure some way out of this thing!
./data/CommonVoice2_dataset/clips/common_voice_en_144000.mp3,we'll fix you up.
./data/CommonVoice2_dataset/clips/common_voice_en_144001.mp3,the country lane was muddy and poorly lit.
./data/CommonVoice2_dataset/clips/common_voice_en_144002.mp3,the article should discuss possible approaches to image registration.
./data/CommonVoice2_dataset/clips/common_voice_en_144003.mp3,but he takes advantage of you.
./data/CommonVoice2_dataset/clips/common_voice_en_144004.mp3,i was wondering if you could tell me a bit more about what it's like to live and work there.
./data/CommonVoice2_dataset/clips/common_voice_en_144005.mp3,a whole week in bermuda.
./data/CommonVoice2_dataset/clips/common_voice_en_144006.mp3,who's this guy she's gonna marry?
./data/CommonVoice2_dataset/clips/common_voice_en_144007.mp3,coming down the block is the biggest steamroller i have ever seen.
./data/CommonVoice2_dataset/clips/common_voice_en_144008.mp3,they'll believe him.
./data/CommonVoice2_dataset/clips/common_voice_en_144009.mp3,carol hid inside the shipping container.
./data/CommonVoice2_dataset/clips/common_voice_en_144010.mp3,it'll be for life!
./data/CommonVoice2_dataset/clips/common_voice_en_144011.mp3,"when i have read a million of these sentences, i am going to apply as a professional narrator."
./data/CommonVoice2_dataset/clips/common_voice_en_144012.mp3,come out of there.
./data/CommonVoice2_dataset/clips/common_voice_en_144013.mp3,"using script blockers is generally a good idea, but it requires the user to learn a bit."
./data/CommonVoice2_dataset/clips/common_voice_en_144014.mp3,i'll dig up that five thousand somehow.
./data/CommonVoice2_dataset/clips/common_voice_en_144015.mp3,the one we pick has gotta be the typical average person.
./data/CommonVoice2_dataset/clips/common_voice_en_144016.mp3,but no one actually saw her die.
./data/CommonVoice2_dataset/clips/common_voice_en_17336927.mp3,overhead projectors were popular in the twentieth century.
./data/CommonVoice2_dataset/clips/common_voice_en_17336928.mp3,"in the morning, i will visit the dentist."
./data/CommonVoice2_dataset/clips/common_voice_en_17336929.mp3,the building is scheduled to open in twenty-twenty-three.
./data/CommonVoice2_dataset/clips/common_voice_en_17336951.mp3,but what is it?
./data/CommonVoice2_dataset/clips/common_voice_en_17336952.mp3,treat the problem with rigorous mathematical analysis.
./data/CommonVoice2_dataset/clips/common_voice_en_17336953.mp3,"lastly, do not forget to submit your assignment by this week."
./data/CommonVoice2_dataset/clips/common_voice_en_17336978.mp3,the owner's eye fattens the horse.
./data/CommonVoice2_dataset/clips/common_voice_en_17336979.mp3,to fleece him smartly.
./data/CommonVoice2_dataset/clips/common_voice_en_17336991.mp3,we were only half a mile from the destination when the engine packed in.
./data/CommonVoice2_dataset/clips/common_voice_en_17336992.mp3,to rap one's knuckles to clip one's wings.
./data/CommonVoice2_dataset/clips/common_voice_en_86399.mp3,no category seems to fit.
./data/CommonVoice2_dataset/clips/common_voice_en_86400.mp3,it's a temporary tattoo that looks like... a color wheel?
./data/CommonVoice2_dataset/clips/common_voice_en_86401.mp3,we have also started contemplating the possibility of moving back to colorado.
./data/CommonVoice2_dataset/clips/common_voice_en_86402.mp3,please search and get me the east is red saga.
./data/CommonVoice2_dataset/clips/common_voice_en_86403.mp3,the griffin is a legendary creature.
./data/CommonVoice2_dataset/clips/common_voice_en_86404.mp3,it always helps to be learning something new and exciting.
./data/CommonVoice2_dataset/clips/common_voice_en_86405.mp3,that's all mark ever talks about.
./data/CommonVoice2_dataset/clips/common_voice_en_86406.mp3,smiling is just part of living a fulfilled life.
./data/CommonVoice2_dataset/clips/common_voice_en_86407.mp3,"the sea has lived on in this shell, because that's its destiny."
./data/CommonVoice2_dataset/clips/common_voice_en_86408.mp3,"the land was ruined, and i had to find some other way to earn a living."
./data/CommonVoice2_dataset/clips/common_voice_en_86409.mp3,do you mind if we go someplace crowded?
./data/CommonVoice2_dataset/clips/common_voice_en_86412.mp3,he still had some doubts about the decision he had made.
./data/CommonVoice2_dataset/clips/common_voice_en_86413.mp3,better hurry and shave.
./data/CommonVoice2_dataset/clips/common_voice_en_86414.mp3,you got to help us.
./data/CommonVoice2_dataset/clips/common_voice_en_86415.mp3,don't you want me to stay?
./data/CommonVoice2_dataset/clips/common_voice_en_86416.mp3,can you hear me?
./data/CommonVoice2_dataset/clips/common_voice_en_86417.mp3,the bestselling novel was read four million times.
./data/CommonVoice2_dataset/clips/common_voice_en_86418.mp3,all the words you've got.
./data/CommonVoice2_dataset/clips/common_voice_en_86419.mp3,the airplane calmly soared through the clouds.
./data/CommonVoice2_dataset/clips/common_voice_en_86420.mp3,add la voce to my dubstep dangles dirty playlist
./data/CommonVoice2_dataset/clips/common_voice_en_86421.mp3,it's done in america all the time.
./data/CommonVoice2_dataset/clips/common_voice_en_86423.mp3,will you trust him that he does it right?
./data/CommonVoice2_dataset/clips/common_voice_en_86424.mp3,the chinese built a monorail train that floats on a magnetic field.
./data/CommonVoice2_dataset/clips/common_voice_en_86425.mp3,the rusty door makes a screeching sound.
./data/CommonVoice2_dataset/clips/common_voice_en_86426.mp3,is chronicle of my mother showing at the nearest cinema in 1 minute and 8 seconds.
./data/CommonVoice2_dataset/clips/common_voice_en_86427.mp3,"the boy remembered his dream, and suddenly everything was clear to him."
./data/CommonVoice2_dataset/clips/common_voice_en_86428.mp3,i want it as soon as possible.
./data/CommonVoice2_dataset/clips/common_voice_en_86429.mp3,the weather forecast for this week didn't look good at all.
./data/CommonVoice2_dataset/clips/common_voice_en_86430.mp3,the first rule of don't fight club is let's talk about it.
./data/CommonVoice2_dataset/clips/common_voice_en_86432.mp3,did you hear what i said?
./data/CommonVoice2_dataset/clips/common_voice_en_86433.mp3,jackson was glad that he'd wore kevlar that morning.
./data/CommonVoice2_dataset/clips/common_voice_en_86434.mp3,the stale smell of old beer lingers.
./data/CommonVoice2_dataset/clips/common_voice_en_86435.mp3,"before him was an enormous white horse, rearing over him with a frightening scream."
./data/CommonVoice2_dataset/clips/common_voice_en_86436.mp3,"if you want to contradict what i just said, you will have to provide footnotes."
./data/CommonVoice2_dataset/clips/common_voice_en_86437.mp3,she was waiting for her response.
./data/CommonVoice2_dataset/clips/common_voice_en_86438.mp3,give highways in hiding a 5 out of 6 points.
./data/CommonVoice2_dataset/clips/common_voice_en_86439.mp3,they're closing in on you!
./data/CommonVoice2_dataset/clips/common_voice_en_86440.mp3,she wants to send you on a lecture tour.
./data/CommonVoice2_dataset/clips/common_voice_en_86441.mp3,his old ferrari has been compacted to a small cube of metal at the junkyard.
./data/CommonVoice2_dataset/clips/common_voice_en_86442.mp3,what's she talking about?
./data/CommonVoice2_dataset/clips/common_voice_en_86443.mp3,i'll be right with you.
./data/CommonVoice2_dataset/clips/common_voice_en_86444.mp3,you know it is!
./data/CommonVoice2_dataset/clips/common_voice_en_86445.mp3,they can't help themselves.
./data/CommonVoice2_dataset/clips/common_voice_en_86446.mp3,the monk laughed when he saw me come back in tatters.
./data/CommonVoice2_dataset/clips/common_voice_en_86447.mp3,his hip struck the knee of the next player.
./data/CommonVoice2_dataset/clips/common_voice_en_86448.mp3,nasa plans to launch the rocket tomorrow.
./data/CommonVoice2_dataset/clips/common_voice_en_86449.mp3,not even a stick of gum.
./data/CommonVoice2_dataset/clips/common_voice_en_86450.mp3,i have also experimented with a fancier solution to this problem.
./data/CommonVoice2_dataset/clips/common_voice_en_86451.mp3,he felt invisible among all those young people.
./data/CommonVoice2_dataset/clips/common_voice_en_86452.mp3,the big charleston contest.
./data/CommonVoice2_dataset/clips/common_voice_en_86453.mp3,there is not even the possibility of doing that.
./data/CommonVoice2_dataset/clips/common_voice_en_86454.mp3,that rollercoaster was insane!
./data/CommonVoice2_dataset/clips/common_voice_en_86455.mp3,you can only spit out so many seeds.
./data/CommonVoice2_dataset/clips/common_voice_en_86456.mp3,"he really wants us to be friends, but we hardly have anything in common!"
./data/CommonVoice2_dataset/clips/common_voice_en_86457.mp3,they continued across the desert.
./data/CommonVoice2_dataset/clips/common_voice_en_86458.mp3,"instead, the stranger lowered it slowly, until the point touched the boy's forehead."
./data/CommonVoice2_dataset/clips/common_voice_en_86459.mp3,the next thing the dope wants is a room.
./data/CommonVoice2_dataset/clips/common_voice_en_86462.mp3,you're on the board here.
./data/CommonVoice2_dataset/clips/common_voice_en_86463.mp3,"for our purposes, of course, we'll want to use a voice command."
./data/CommonVoice2_dataset/clips/common_voice_en_17256473.mp3,"he could have sworn the shadow moved but he kept his eyes fixed on the table, his grip tightening on his cutlery."
./data/CommonVoice2_dataset/clips/common_voice_en_17256475.mp3,"as one door closes, another always opens."
./data/CommonVoice2_dataset/clips/common_voice_en_17256476.mp3,"we need to be confident, all of us."
./data/CommonVoice2_dataset/clips/common_voice_en_17256477.mp3,"when there's a loss of cabin pressure, oxygen masks will automatically drop down."
./data/CommonVoice2_dataset/clips/common_voice_en_17256478.mp3,"when luke had finished the hazard analysis, he frowned."
./data/CommonVoice2_dataset/clips/common_voice_en_17256479.mp3,"when she tried to withdraw some money from her bank account, the atm claimed her card was invalid."
./data/CommonVoice2_dataset/clips/common_voice_en_17256480.mp3,may i escort you to the garage?
./data/CommonVoice2_dataset/clips/common_voice_en_17256481.mp3,who has already arrived?
./data/CommonVoice2_dataset/clips/common_voice_en_17256482.mp3,"view the reviews, comments and ratings on the website."
./data/CommonVoice2_dataset/clips/common_voice_en_17256483.mp3,"living alone, she made solitude her best friend."
./data/CommonVoice2_dataset/clips/common_voice_en_17256484.mp3,"very well, she said."
./data/CommonVoice2_dataset/clips/common_voice_en_17256485.mp3,are you sure that is exactly what happened?
./data/CommonVoice2_dataset/clips/common_voice_en_17256486.mp3,do i know it?
./data/CommonVoice2_dataset/clips/common_voice_en_17256487.mp3,"when he saw the storm clouds in the sky, jaka wished he would have remembered his umbrella."
./data/CommonVoice2_dataset/clips/common_voice_en_17256488.mp3,what are you going to do?
./data/CommonVoice2_dataset/clips/common_voice_en_17256489.mp3,"madam, this is the best brand of corn."
./data/CommonVoice2_dataset/clips/common_voice_en_17256490.mp3,"deeds are fruits, words are but leaves."
./data/CommonVoice2_dataset/clips/common_voice_en_17256491.mp3,"this pepperoni tastes off, she said."
./data/CommonVoice2_dataset/clips/common_voice_en_17256492.mp3,i wonder what he wants?
./data/CommonVoice2_dataset/clips/common_voice_en_17256493.mp3,"the space was spartan, almost bare."
./data/CommonVoice2_dataset/clips/common_voice_en_17256494.mp3,where did he go?
./data/CommonVoice2_dataset/clips/common_voice_en_17256495.mp3,did you see it?
./data/CommonVoice2_dataset/clips/common_voice_en_17256496.mp3,"no, but i saw a gift shop."
./data/CommonVoice2_dataset/clips/common_voice_en_17256497.mp3,no wonder this vanilla yogurt tastes disgusting: its eat-by date was last year.
./data/CommonVoice2_dataset/clips/common_voice_en_17256498.mp3,"i was screwing the screw with a screwdriver, then i said ""screw it."""
./data/CommonVoice2_dataset/clips/common_voice_en_17256499.mp3,check the person and/or company who owns this website.
./data/CommonVoice2_dataset/clips/common_voice_en_17256500.mp3,"""one moment,"" she said."
./data/CommonVoice2_dataset/clips/common_voice_en_17256501.mp3,where did it come from then?
./data/CommonVoice2_dataset/clips/common_voice_en_17256502.mp3,"well, that's all right."
./data/CommonVoice2_dataset/clips/common_voice_en_17256503.mp3,"salmon is one of the most popular fish and very delicious, though usually not sustainable."
./data/CommonVoice2_dataset/clips/common_voice_en_17256504.mp3,"the gallant noble, good man thinks of himself last."
./data/CommonVoice2_dataset/clips/common_voice_en_17256505.mp3,how much do you want?
./data/CommonVoice2_dataset/clips/common_voice_en_17256506.mp3,won't you sit down?
./data/CommonVoice2_dataset/clips/common_voice_en_17256507.mp3,"yes, but why is there straw anyway?"
./data/CommonVoice2_dataset/clips/common_voice_en_17256508.mp3,"before you get too excited, keep in mind that it only applies to low-dimensional problems."
./data/CommonVoice2_dataset/clips/common_voice_en_17256509.mp3,"darling, we've run out of avocados!"
./data/CommonVoice2_dataset/clips/common_voice_en_17256510.mp3,what else am i to do?
./data/CommonVoice2_dataset/clips/common_voice_en_17256512.mp3,"compared to other countries in the world, japan has a very low birth rate."
./data/CommonVoice2_dataset/clips/common_voice_en_17256513.mp3,"alice, who the fuck is bob?"
./data/CommonVoice2_dataset/clips/common_voice_en_17256514.mp3,"little thieves are hanged, but great ones escape."
./data/CommonVoice2_dataset/clips/common_voice_en_17256515.mp3,"""i'm observing passive-aggressive behavior"", the psychologist said in a professional tone."
./data/CommonVoice2_dataset/clips/common_voice_en_17256516.mp3,"nora finds herself ugly, because she has pimples."
./data/CommonVoice2_dataset/clips/common_voice_en_17256517.mp3,what are you doing here?
./data/CommonVoice2_dataset/clips/common_voice_en_17256518.mp3,"pork cutlet is also very tasty, but our religion does not allow us to eat it."
./data/CommonVoice2_dataset/clips/common_voice_en_17256519.mp3,what's the matter with them?
./data/CommonVoice2_dataset/clips/common_voice_en_17256520.mp3,"to the world you may be one person, but to one person, you may be the world."
./data/CommonVoice2_dataset/clips/common_voice_en_17256521.mp3,and what are you doing here?
./data/CommonVoice2_dataset/clips/common_voice_en_17256522.mp3,what is she to do?
./data/CommonVoice2_dataset/clips/common_voice_en_17256523.mp3,but what if all our readers were whispering?
./data/CommonVoice2_dataset/clips/common_voice_en_17256524.mp3,"please don't feed the pigeons, or else they will haunt you forever!"
./data/CommonVoice2_dataset/clips/common_voice_en_17256525.mp3,"you two in the last row, stop giggling!"
./data/CommonVoice2_dataset/clips/common_voice_en_17256526.mp3,"twenty five units, please."
./data/CommonVoice2_dataset/clips/common_voice_en_17256527.mp3,"when alvin was a little boy, he loved to watch bud spencer and terence hill."
./data/CommonVoice2_dataset/clips/common_voice_en_17256528.mp3,you don't like him?
./data/CommonVoice2_dataset/clips/common_voice_en_17256529.mp3,"there was an accident at work, a camel stampede nearly killed the janitor."
./data/CommonVoice2_dataset/clips/common_voice_en_17256530.mp3,"as he couldn't prove his innocence, he was brought to the detention zone, as if guilty."
./data/CommonVoice2_dataset/clips/common_voice_en_17256531.mp3,what do you want me to do?
./data/CommonVoice2_dataset/clips/common_voice_en_17256532.mp3,what did he mean?
./data/CommonVoice2_dataset/clips/common_voice_en_17256533.mp3,"well, i can guess how that turned out."
./data/CommonVoice2_dataset/clips/common_voice_en_17256534.mp3,do you understand that?
./data/CommonVoice2_dataset/clips/common_voice_en_569339.mp3,"when the sun sets, the men will once again surrender their arms to me."
./data/CommonVoice2_dataset/clips/common_voice_en_569340.mp3,i couldn't stop staring at it.
./data/CommonVoice2_dataset/clips/common_voice_en_569341.mp3,"you and i aren't like hassan, that rich merchant."
./data/CommonVoice2_dataset/clips/common_voice_en_569346.mp3,"""it means only that the heart does what it can,"" the alchemist said."
./data/CommonVoice2_dataset/clips/common_voice_en_569347.mp3,the meeting was over.
./data/CommonVoice2_dataset/clips/common_voice_en_569348.mp3,but then he remembered that he wasn't going to have to pay anything.
./data/CommonVoice2_dataset/clips/common_voice_en_569349.mp3,no one paid any attention to the two travelers.
./data/CommonVoice2_dataset/clips/common_voice_en_569350.mp3,the wind approached the boy and touched his face.
./data/CommonVoice2_dataset/clips/common_voice_en_569351.mp3,but they were not there.
./data/CommonVoice2_dataset/clips/common_voice_en_569352.mp3,"neighbors moved away, and there remained only a few small shops on the hill."
./data/CommonVoice2_dataset/clips/common_voice_en_569353.mp3,"toward the end of the afternoon, they came upon a coptic monastery."
./data/CommonVoice2_dataset/clips/common_voice_en_569354.mp3,it had a diameter of about thirty yards.
./data/CommonVoice2_dataset/clips/common_voice_en_569356.mp3,"""because my eyes are not yet accustomed to the desert,"" the boy said."
./data/CommonVoice2_dataset/clips/common_voice_en_569357.mp3,"""but my heart is agitated,"" the boy said."
./data/CommonVoice2_dataset/clips/common_voice_en_569358.mp3,he recited an our father silently.
./data/CommonVoice2_dataset/clips/common_voice_en_569359.mp3,you could have died after peace had been declared.
./data/CommonVoice2_dataset/clips/common_voice_en_569360.mp3,i heard a faint movement under my feet.
./data/CommonVoice2_dataset/clips/common_voice_en_569361.mp3,"but, if you can, try to make your own decisions."
./data/CommonVoice2_dataset/clips/common_voice_en_569362.mp3,"""did you learn anything?"" the englishman asked, eager to hear what it might be."
./data/CommonVoice2_dataset/clips/common_voice_en_569363.mp3,you will never be able to escape from your heart.
./data/CommonVoice2_dataset/clips/common_voice_en_569364.mp3,and i will tell you how to find the hidden treasure.
./data/CommonVoice2_dataset/clips/common_voice_en_569365.mp3,"that night, he told all of this to the alchemist."
./data/CommonVoice2_dataset/clips/common_voice_en_569366.mp3,"""exactly,"" answered the alchemist."
./data/CommonVoice2_dataset/clips/common_voice_en_569367.mp3,"""to show you one of life's simple lessons,"" the alchemist answered."
./data/CommonVoice2_dataset/clips/common_voice_en_569368.mp3,"the alchemist erased the circle in the sand, and the snake slithered away among the rocks."
./data/CommonVoice2_dataset/clips/common_voice_en_569370.mp3,"""we could get to the pyramids by tomorrow,"" said the other, taking the money."
./data/CommonVoice2_dataset/clips/common_voice_en_569372.mp3,"then he took from his knapsack a bottle of wine, and drank some."
./data/CommonVoice2_dataset/clips/common_voice_en_569373.mp3,"one night, the father had a dream."
./data/CommonVoice2_dataset/clips/common_voice_en_569375.mp3,"""be careful with your prognostications,"" said the stranger."
./data/CommonVoice2_dataset/clips/common_voice_en_569378.mp3,not until the moon was high did the alchemist ride into view.
./data/CommonVoice2_dataset/clips/common_voice_en_569379.mp3,even though the sheep didn't teach me to speak arabic.
./data/CommonVoice2_dataset/clips/common_voice_en_569380.mp3,they're just a pile of stones.
./data/CommonVoice2_dataset/clips/common_voice_en_569381.mp3,"that night, there was another jetting out of gas from the distant planet."
./data/CommonVoice2_dataset/clips/common_voice_en_569382.mp3,replace the ts in tim tebow's name with any other consonant to get a star wars character
./data/CommonVoice2_dataset/clips/common_voice_en_569383.mp3,"the old man wore a breastplate of gold, and he knew about my past."
./data/CommonVoice2_dataset/clips/common_voice_en_569385.mp3,"""i am proud of you,"" he said."
./data/CommonVoice2_dataset/clips/common_voice_en_569387.mp3,"his heart was heavy, and he had been melancholy since the previous night."
./data/CommonVoice2_dataset/clips/common_voice_en_569390.mp3,"trust in your heart, but never forget that you're in the desert."
./data/CommonVoice2_dataset/clips/common_voice_en_569391.mp3,"the boy prodded them, one by one, with his crook, calling each by name."
./data/CommonVoice2_dataset/clips/common_voice_en_569393.mp3,how do people celebrate good weather over there?
./data/CommonVoice2_dataset/clips/common_voice_en_569394.mp3,"from where he sat, he could observe the plaza."
./data/CommonVoice2_dataset/clips/common_voice_en_569395.mp3,"""but none of that is from the pyramids,"" said the alchemist."
./data/CommonVoice2_dataset/clips/common_voice_en_569396.mp3,"the tribal chieftains will see that, and you'll be dismissed from your position as counselor."
./data/CommonVoice2_dataset/clips/common_voice_en_569397.mp3,you point to a trail of ants leading into the house.
./data/CommonVoice2_dataset/clips/common_voice_en_569399.mp3,he quickly pulled his hands away.
./data/CommonVoice2_dataset/clips/common_voice_en_569400.mp3,i wanted them to be a part of your inheritance.
./data/CommonVoice2_dataset/clips/common_voice_en_569401.mp3,"""they're not for sale,"" he said."
./data/CommonVoice2_dataset/clips/common_voice_en_569402.mp3,"""don't be impatient,"" he repeated to himself."
./data/CommonVoice2_dataset/clips/common_voice_en_569404.mp3,they were his treasure.
./data/CommonVoice2_dataset/clips/common_voice_en_569406.mp3,"i've already had that experience with my sheep, and now it's happening with people."
./data/CommonVoice2_dataset/clips/common_voice_en_569407.mp3,"""this is what was written on the emerald tablet,"" said the alchemist, when he had finished."
./data/CommonVoice2_dataset/clips/common_voice_en_569408.mp3,"a friend had told the boy about the shop, and he had taken his sheep there."
./data/CommonVoice2_dataset/clips/common_voice_en_569410.mp3,"""can i help you?"" asked the man behind the window."
./data/CommonVoice2_dataset/clips/common_voice_en_569411.mp3,"""but i'd like to see the castles in the towns where they live,"" the boy explained."
./data/CommonVoice2_dataset/clips/common_voice_en_569412.mp3,"but when the reign of tiberius ended, his poems were forgotten."
./data/CommonVoice2_dataset/clips/common_voice_en_569413.mp3,"in order to find the treasure, you will have to follow the omens."
./data/CommonVoice2_dataset/clips/common_voice_en_569414.mp3,the omens had told him so.
./data/CommonVoice2_dataset/clips/common_voice_en_569416.mp3,"he wants me to write down only things that i think about, but not things i plan to do."
./data/CommonVoice2_dataset/clips/common_voice_en_569417.mp3,"if you have to wait until the war is over, then wait."
./data/CommonVoice2_dataset/clips/common_voice_en_569418.mp3,he had understood the story the old king had told him.
./data/CommonVoice2_dataset/clips/common_voice_en_569419.mp3,"the boy fell to the sand, nearly unconscious."
./data/CommonVoice2_dataset/clips/common_voice_en_569420.mp3,"""these are the spies,"" said one of the men."
./data/CommonVoice2_dataset/clips/common_voice_en_535360.mp3,what is the weather forecast for cistern
./data/CommonVoice2_dataset/clips/common_voice_en_535361.mp3,dog catching a red frisbee.
./data/CommonVoice2_dataset/clips/common_voice_en_535362.mp3,a redhaired woman talking on the phone while petting a brown and tan dog.
./data/CommonVoice2_dataset/clips/common_voice_en_535364.mp3,karate kick in the desert
./data/CommonVoice2_dataset/clips/common_voice_en_535365.mp3,two dogs shake off water in an area with very little vegetation.
./data/CommonVoice2_dataset/clips/common_voice_en_535366.mp3,two teams playing a game of football.
./data/CommonVoice2_dataset/clips/common_voice_en_535367.mp3,a cat under the bench hissing with a dog growling and trying to get it.
./data/CommonVoice2_dataset/clips/common_voice_en_535368.mp3,a man and little girl in a pink life vest and red flotation device swimming.
./data/CommonVoice2_dataset/clips/common_voice_en_535369.mp3,a man is using his phone on a bus.
./data/CommonVoice2_dataset/clips/common_voice_en_535370.mp3,woman in black scarf being licked by a black dog.
./data/CommonVoice2_dataset/clips/common_voice_en_535372.mp3,three males are together with two of them wearing blue shirts.
./data/CommonVoice2_dataset/clips/common_voice_en_535374.mp3,happy amusement park riders on a theme park ride.
./data/CommonVoice2_dataset/clips/common_voice_en_535375.mp3,a boy swings his bat in anticipation of hitting a practice ball on a stand.
./data/CommonVoice2_dataset/clips/common_voice_en_535376.mp3,three children wrestle on a floral carpet.
./data/CommonVoice2_dataset/clips/common_voice_en_535378.mp3,a nurse poses for a picture with a mother and her newborn.
./data/CommonVoice2_dataset/clips/common_voice_en_535379.mp3,a group of men work in a kitchen.
./data/CommonVoice2_dataset/clips/common_voice_en_535382.mp3,man jumping off a rock into water.
./data/CommonVoice2_dataset/clips/common_voice_en_535383.mp3,a young woman leaps into the air with the us capitol building in the background.
./data/CommonVoice2_dataset/clips/common_voice_en_535385.mp3,a man sitting with an elderly homeless person in a park.
./data/CommonVoice2_dataset/clips/common_voice_en_535386.mp3,one person in blue leggings enjoying ice skating.
